{
  "schema_version": "dr-paired-single-paper-e2e-v1",
  "provider": "zhipu-bigmodel",
  "model_id": "glm-5.3-flash",
  "endpoint": "https://open.bigmodel.cn/api/paas/v4/chat/completions",
  "credential_environment_variable": "ZHIPUAI_API_KEY",
  "channel": "ordinary_model_api",
  "text_only": true,
  "thinking": "enabled",
  "planner_reasoning_effort": "low",
  "writer_reasoning_effort": "high",
  "planner_max_input_tokens": 2048,
  "writer_max_input_tokens": 4096,
  "planner_max_output_tokens": 4096,
  "writer_max_output_tokens": 4096,
  "max_provider_calls": 2,
  "max_provider_attempts": 2,
  "max_retries": 0,
  "max_replans": 1,
  "operation_timeout_seconds": 60,
  "run_timeout_seconds": 180,
  "fallback_enabled": false,
  "tools_enabled": false,
  "web_enabled": false,
  "vision_enabled": false,
  "files_enabled": false,
  "parallel_enabled": false,
  "task_id": "dr-task-45549b8a9e84b6eb6f63d07f",
  "brief_id": "dr-brief-86d7f913eda276ef07a8fd57",
  "attempt_id": "paired-glm-single-paper-001",
  "run_id": "dr-run-f8d0cba03855233691766953",
  "artifact_dir": "outputs/deep_research/e2e/v1.2/dr-run-f8d0cba03855233691766953",
  "implementation_commit_sha": "eac0521504e82b6a8ab52d9f9a74d435bc21b6f5",
  "runtime_source_sha256": "b5ff116c2ce63196e5ce5ba66ebaadffb7b57bb469c4b1d3a8f89fd24cb25684",
  "corpus_path": "outputs/rag_bm25_v1/passages.jsonl",
  "corpus_sha256": "d099dc9ef22678af17ffbb12fc5198c9a6fce71d56576dde6f2b62984b8a7de6",
  "planner_prompt_sha256": "cfd418a50d2c9a91230994a24bf0605f4db336fd557f0f2a13135112dee1bd3b",
  "writer_prompt_sha256": "a0a3ead0fccac18ffb0d92e6e150b56e5943ad29971259b34b45431f176257e1",
  "task_input_sha256": "e92abac216c15ed54e3fdee5a209d4adabafef442fad3e3aa9827d6585c0c64f",
  "monetary_budget_currency": "CNY",
  "input_price_per_million": "0.4",
  "cache_hit_input_price_per_million": "0",
  "output_price_per_million": "1.4",
  "monetary_budget_limit_micros": "20000",
  "acceptance_metrics": ["terminal_status", "grounding", "claims_citations", "replay_zero_calls", "tokens", "provider_native_cost", "client_elapsed", "author_review_required"]
}
